Sentence,Verb_index,Verb,Verb_lemma,Prefix,Stem,Subject,Preposition,Object,Object_case,Object_lemma,Unified_preposition,Motion_type,
"При дотриманні принципу дао можливо бездіяльність, недіяння, що приводить проте до повної свободи, щастя і процвітання.",8,приводить,приводити,при,води́ти,,до,свободи,Gen,свобода,До,metaphorical,
"Інвалідизація від психічних захворювань вийшла на друге місце серед інших захворювань, – зазначив керівник дитячої лікарні.",4,вийшла,вийти,ви,іти́/йти́,Інвалідизація,на,місце,Acc,місце,На,metaphorical,
"Херсонець Андрій Наливайко повідомляв, що був викраденим невідомими людьми, котрі вивезли його у ліс та допитували по справі Гандзюк.",10,вивезли,вивезти,ви,везти́,котрі,у,ліс,Acc,ліс,В,literal,
До складу входять тільки екологічно чисті продукти.,2,входять,входити,в,ходи́ти,продукти,до,складу,Gen,склад,До,metaphorical,
"Стародавні політичні та соціальні вчення в Єгипті, Індії, Китаї, Греції та на інших територіях землі відображали лише основні характеристики ранніх типів суспільства, що прийшли на зміну первісному суспільству.",23,прийшли,прийти,при,іти́/йти́,,на,зміну,Acc,зміна,На,metaphorical,
"Архівний відділ Бахмутської міської ради доводить до відома громадян, що прийом громадян з видачі довідок соціально-правового характеру буде здійснюватись в адміністративної будівлі Бахмутської міської ради за графіком: вівторок, четвер з 8-00 до17-00.",5,доводить,доводити,до,води́ти,відділ,до,відома,Gen,відомий,До,metaphorical,
"Завдяки спокійній кольоровій гамі, до якої входить ніжно-блакитний та глибокий синій кольори, робить сюжет картини легким і заспокійливим.",6,входить,входити,в,ходи́ти,кольори,до,якої,Gen,який,До,metaphorical,
"На превеликий жаль, 30 липня цього року пані Стефа відійшла у вічність, але її спогади закарбовані у цьому тексті.",9,відійшла,відійти,від,іти́/йти́,пані,у,вічність,Acc,вічність,В,metaphorical,
"Чотири роки потому, 12 серпня 1981, на ринок вийшов IBM PC - перший масовий персональний комп'ютер, пише gazeta.",8,вийшов,вийти,ви,іти́/йти́,IBM,на,ринок,Acc,ринок,На,metaphorical,
А нова книга «Назови мене своєю» уже ввійшла до Топ 5-ки найбільш читаних книжок України.,7,ввійшла,ввійти,в,іти́/йти́,книга,до,Топ,Gen,топ,До,metaphorical,
"Якщо до тебе прийшли на пару, згадай, що ти артист, ти кращий педагог країни, ти найщасливіша людина.",3,прийшли,прийти,при,іти́/йти́,,на,пару,Acc,пара,На,literal,
"Учені з Австралії визначили, що харчова добавка на основі наночасток Е171 (діоксид титану), може привести до раку товстого кишечника.",14,привести,привести,при,вести́,,до,раку,Gen,рака,До,metaphorical,
"До складу перевірених за гендерних аудитом інституцій (вісім) увійшли державні заклади, що надають послуги, які є пріоритетними для дівчат та жінок із інвалідністю або жінок, які мають дітей з інвалідністю.",8,увійшли,увійти,в,іти́/йти́,заклади,до,складу,Gen,склад,До,metaphorical,
"Правоохоронці встановили, що зловмисник виходив на «полювання» уночі.",4,виходив,виходити,ви,ходи́ти,зловмисник,на,полювання,Acc,полювання,На,literal,
"Захист насіння Bayer представлений в достатньо широкій лінійці різних високоефективних засобів та інноваційних препаратів, до складу яких входять ефективні і безпечні для людей і тварин біологічні та хімічні діючі речовини.",17,входять,входити,в,ходи́ти,речовини,до,складу,Gen,склад,До,metaphorical,
"В програму входить опрацювання розмовних тем і граматичних конструкцій, перегляд та опрацювання відео та аудіо матеріалу тощо.",2,входить,входити,в,ходи́ти,опрацювання,в,програму,Acc,програма,В,metaphorical,
"До числа найпопулярніших гаманців даного типу можна віднести Toast Wallet, а також Dice Wallet.",7,віднести,віднести,від,нести́,,до,числа,Gen,число,До,metaphorical,
"На сьогоднішній стан педагогічної культури впливають такі зовнішні чинники як: середовище проживання, суспільно-професійний тип сім% актуальні зміни (безробіття, ритм життя, брак часу, обмеження у педагогічній освіті батьків).",5,впливають,впливати,в,пла́вати,чинники,на,стан,Acc,стан,На,metaphorical,another meaning
"Супорт в цих країнах так само б відніс до північного стилю ультрас, оскільки дуже часті паузи між зарядами, ну а багато тем в зухвальмо скопійовано у італійців.",7,відніс,віднести,від,нести́,,до,стилю,Gen,стиль,До,metaphorical,
"Від російської громади купців маклерами були призначені три чоловіки, від іноземної - два, а також по одному нотаріусу від кожної з громад. До обов'язків маклерів і нотаріусів входило укладення угод-договорів з товарами, запис векселів та ін.",27,входило,входити,в,ходи́ти,укладення,до,обов'язків,Gen,обов’язок,До,metaphorical,
"Одеська дирекція ВАТ “Укртелеком” доводить до відома споживачів про тимчасове припинення замовлень на послугу ""Довідка про номер телефону"" по абонентах квартирного сектору населених пунктів Росії.",4,доводить,доводити,до,води́ти,дирекція,до,відома,Gen,відомий,До,metaphorical,
Він привів на польський ринок британського виробника масок.,1,привів,привести,при,вести́,Він,на,ринок,Acc,ринок,На,metaphorical,
"У 1913 р. редагував більшовицький легальний журнал «Вопросы страхования», у 1914 р. входив до складу редколегії газети «Правда».",12,входив,входити,в,ходи́ти,,до,складу,Gen,склад,До,metaphorical,
"Сергій Макаров додає: якщо кліщ, якого ви віднесли в лабораторію, не заражений, то існують ризики, що ви могли не помітити укус зараженого кліща.",7,віднесли,віднести,від,нести́,ви,в,лабораторію,Acc,лабораторій,В,literal,
"Я не прийшов в монастир, а залишився в монастирі»",2,прийшов,прийти,при,іти́/йти́,Я,в,монастир,Acc,монастир,В,literal,
"Якщо говорити про частиномовну приналежність лексем, які необхідні для розуміння української мови хоча б на рівні А1, то цілком зрозуміло, що до переліку найнеобхідніших ввійдуть слова з абсолютно всіх частин мови.",24,ввійдуть,ввійти,в,іти́/йти́,слова,до,переліку,Gen,перелік,До,metaphorical,
"Такі обсяги державного боргу, у 2,8 раза більші, ніж звітує Міністерство фінансів, створюють реальну загрозу економічній безпеці держави та зводять до надзвичайно низького рівня її інвестиційний рейтинг.",19,зводять,зводити,з,води́ти,,до,рівня,Gen,рівень,До,metaphorical,
"По можливості слід виявити в кожному випадку основні етіологічні та патогенетичні фактори, щоб активно впливати на них.",14,впливати,впливати,в,пла́вати,,на,них,Acc,вони,На,metaphorical,another meaning
"У жовтні Сома Морґенштерн змушений виїхати до табору у Монтаржі, тоді ж дізнається про загибель брата Мозеса у Бухенвальді.",5,виїхати,виїхати,ви,ї́хати,,до,табору,Gen,табір,До,literal,
"Знайти баланс між декількома різними точками зору досить важко, тому менеджерам будь-яких ланок необхідно контролювати настрої в тій чи іншій групі та за нездатності впливати на їх позицію, виникає потреба знаходити точку комромісу між сторонами.",24,впливати,впливати,в,пла́вати,,на,позицію,Acc,позиція,На,metaphorical,another meaning
"Другу книгу «Я лиш струна на арфі України» Олександра вичитала, але за життя так і не побачила надрукованої книги, збірка вийшла вже в пам’ять про неї.",20,вийшла,вийти,ви,іти́/йти́,збірка,в,пам’ять,Acc,пам’ять,В,metaphorical,
"До прояву гіпоглікемії відносять наступні симптоми: прискорене серцебиття, підвищене потовиділення, тремтіння рук, алергічні прояви у вигляді висипки або свербежу шкірного покриву, розвиток слабкості.",3,відносять,відносити,від,носи́ти,,до,прояву,Gen,прояв,До,metaphorical,
"До їх складу входять відомі в народній медицині лікарські рослини: квіти пижма, листя перцевої м’яти, подрібнена трава буркуну і рубане кореневище оману.",3,входять,входити,в,ходи́ти,рослини,до,складу,Gen,склад,До,metaphorical,
Ми затягли дядька на ґанок.,1,затягли,затягти,за,тягти́,Ми,на,ґанок,Acc,ґанок,На,literal,
"Ми прийшли на фестиваль з нашого кіноклубу Діалог, коли той вже не був оглядом студентських стрічок, але був оглядом колишніх республік Радянського Союзу.",1,прийшли,прийти,при,іти́/йти́,Ми,на,фестиваль,Acc,фестиваль,На,literal,
Компанія входить в транснаціональну корпорацію «Норд Газ Груп».,1,входить,входити,в,ходи́ти,Компанія,в,корпорацію,Acc,корпорація,В,metaphorical,
"Чи зупиняли ви себе, вагаючись: «Як підійти до незнайомої людини?",6,підійти,підійти,під,іти́/йти́,,до,людини,Gen,людина,До,literal,
"Пекучим смаком імбир зобов'язаний фенолоподобній речовині гингеролу, входить до його складу.",7,входить,входити,в,ходи́ти,,до,складу,Gen,склад,До,metaphorical,
"Таргетні препарати впливають на молекулярні структури — зовнішньо- й внутрішньоклітинні рецептори, білки, які продукують клітини пухлини, а також на кровоносні судини пухлини.",2,впливають,впливати,в,пла́вати,препарати,на,структури,Acc,структура,На,metaphorical,another meaning
"Начальник відділу культури, національностей та релігії Бородянської РДА Наталія Вишинська довела до відома присутніх про нагальну потребу в придбанні нової апаратури для Бородянського районного Палацу культури ім.Т.Г. Шевченка.",10,довела,довести,до,вести́,Начальник,до,відома,Gen,відомий,До,metaphorical,
"Г. Почепцов визначає інформаційні війни як «інформаційні технології, що впливають на інформаційні системи, маючи на меті введення в оману, виведення з ладу або десинхронізацію процесів управління суспільством та його складовими, передусім військовими».",9,впливають,впливати,в,пла́вати,,на,системи,Acc,система,На,metaphorical,
Час стрімко і невпинно вносить корективи в усі галузі життя.,4,вносить,вносити,в,носи́ти,Час,в,галузі,Acc,галузь,В,metaphorical,
Відповідні зміни внесли у свої програми і місцеві ради.,2,внесли,внести,в,нести́,,у,програми,Acc,програма,В,metaphorical,
"В другій половині 19 ст. одна частина району входила до Олександрійського повіту Херсонської губернії, інша - до Верходніпровського, Єкатеринославської губернії.",8,входила,входити,в,ходи́ти,частина,до,повіту,Gen,повіт,До,metaphorical,
"Три типи тривоги переплетені поміж собою таким чином, що один із них задає загальний тон, а всі инші вносять додаткові відтінки в стан тривоги.",18,вносять,вносити,в,носи́ти,инші,в,стан,Acc,стан,В,metaphorical,
"До Плану комплексних планових заходів державного нагляду (Наказ Мінекономрозвитку від 30.11.2015 № 1553) увійшли понад 13 тисяч компаній різних форм власності, з різних секторів економіки та з різними ступенями ризику.",13,увійшли,увійти,в,іти́/йти́,,до,Плану,Gen,план,До,metaphorical,
Інші можемо потім привести у відповідність до нього.,3,привести,привести,при,вести́,,у,відповідність,Acc,відповідність,В,metaphorical,
"Серед видатних письменників минулого, творчість яких увійшла в скарбницю світової культури, почесне місце займає класик єврейської літератури Шолом-Алейхем.",6,увійшла,увійти,в,іти́/йти́,творчість,в,скарбницю,Acc,скарбниця,В,metaphorical,
Одразу ж на виклик виїхали чотири бригади обласного центру екстреної медичної допомоги та медицини катастроф.,4,виїхали,виїхати,ви,ї́хати,бригади,на,виклик,Acc,виклик,На,literal,
"V-twin відповідає стандарту EURO4 щодо викиду відпрацьованих газів, входить до числа лідерів у своєму класі за паливною економічністю (3,84 л/100 км*) та максимальною вихідною потужністю.",8,входить,входити,в,ходи́ти,,до,числа,Gen,число,До,metaphorical,
"Після тривалого обговорення присутні прийшли до спільного знаменника: необхідно маркувати продукцію РФ, а покупець сам вирішить, купувати її чи ні.",4,прийшли,прийти,при,іти́/йти́,присутні,до,знаменника,Gen,знаменник,До,metaphorical,
"До порядку денного засідання було внесено 19 питань, кожне з яких є доволі важливим для громад району.",5,внесено,внести,в,нести́,,до,порядку,Gen,порядок,До,metaphorical,
"Це вже було помітно із результатів попередніх парламентських виборів - частина голосів, які раніше мала ""Наша Україна"", відійшла до Блоку Юлії Тимошенко.",17,відійшла,відійти,від,іти́/йти́,,до,Блоку,Gen,блок,До,metaphorical,
"Я закликаю усі держави, які ще не вжили таких заходів, зробити цей невідкладний та важливий крок із захисту здоров’я людей — увести в дію закони, що накладають повну заборону на паління у всіх закритих громадських та робочих місцях».",21,увести,увести,в,вести́,,в,дію,Acc,дія,В,metaphorical,
"Наприкінці 2018 року уряд схвалив та вніс у Верховну Раду ""Про адміністративну процедуру"" (№ 9456).",6,вніс,внести,в,нести́,,у,Раду,Acc,рада,В,metaphorical,
"Відповідно і здійснення правотворчості відбувається за участю не окремого суб'єкта правотворчості, а всіх, хто впливає на здійснення правотворчої діяльності.",14,впливає,впливати,в,пла́вати,хто,на,здійснення,Acc,здійснення,На,metaphorical,another meaning
Основний спосіб заповнення декларації — електронний лікар внесе Ваші дані в систему.,7,внесе,внести,в,нести́,лікар,в,систему,Acc,система,В,metaphorical,
"Біловодське відділення управління виконавчої дирекції Фонду соціального страхування України у Луганській області нагадує працівникам і роботодавцям, що виконання правил безпеки зводить до мінімуму вірогідність настання нещасних випадків на виробництві.",20,зводить,зводити,з,води́ти,виконання,до,мінімуму,Gen,мінімум,До,metaphorical,
Але ціна квитка доходить майже до 20 євро.,3,доходить,доходити,до,ходи́ти,ціна,до,євро,Gen,євро,До,metaphorical,
"Як доказ єдності депутатів довкола гендерних проблем Ковалевська наводить приклад їхнього міжфракційного об’єднання - до нього увійшло 15 депутатів, з них троє - чоловіки.",16,увійшло,увійти,в,іти́/йти́,депутатів,до,нього,Gen,він,До,metaphorical,
"Оскільки у мене є незначні проблеми із здоров’ям, які дозволяють пересуватись, говорити, я прийшов сьогодні в управління, щоб ознайомитись із наказам і підписати його.",13,прийшов,прийти,при,іти́/йти́,я,в,управління,Acc,управління,В,literal,
"Вперше зачитала свій твір Вероніка Ніколаєва, і вийшло це в неї дуже душевно.",7,вийшло,вийти,ви,іти́/йти́,це,в,неї,Acc,вона,В,metaphorical,
"Перетнувши смугу зустрічного руху на повороті, автомобіль виїхав з проїжджої частини у кювет та зіткнувся з металевим дорожнім знаком.",7,виїхав,виїхати,ви,ї́хати,автомобіль,у,кювет,Acc,кювет,В,literal,
"У цьому році на XXII конференцію приїхали науковці з різних регіонів України: Вінниці, Дніпра, Каменського, Києва, Сєверодонецька, Харкова та інших міст, а також представники підприємств із України та Росії.",6,приїхали,приїхати,при,ї́хати,науковці,на,конференцію,Acc,конференція,На,literal,
Привести до гіперчутливості на певні речовини можуть різні фактори.,0,Привести,привести,при,вести́,,на,речовини,Acc,речовина,На,metaphorical,
А потім на святкову сцену вийшли самодіяльні митці Здолбунівщини.,5,вийшли,вийти,ви,іти́/йти́,митці,на,сцену,Acc,сцена,На,literal,
"На передній план лінгвофілософських досліджень виходять проблеми вивчення «чужої свідомості», природи інтенціональних станів, конвенціональних основ значення і спілкування, ситуацій і установок, фактів, раціональної теорії аргументації та рішень тощо.",5,виходять,виходити,ви,ходи́ти,проблеми,на,план,Acc,план,На,metaphorical,
У цій ситуації необхідно ввести руку в піхву і виправити становище ложок.,4,ввести,ввести,в,вести́,,в,піхву,Acc,піхва,В,literal,
