Sentence,Verb_index,Verb,Verb_lemma,Prefix,Stem,Subject,Preposition,Object,Object_case,Object_lemma,Unified_preposition,Motion_type,
"Човном ми перебралися через протоку біля виступу острова, вийшли на високий берег материка і рушили в північно-західному напрямку.",8,вийшли,вийти,ви,іти́/йти́,,на,берег,Acc,берег,На,literal,
"Nissan прийшов до таких висновків, грунтуючись на даних 400 000 електричних автомобілів, які він продав у Європі з 2011 року.",1,прийшов,прийти,при,іти́/йти́,Nissan,до,висновків,Gen,висновок,До,metaphorical,
"На вулиці -2, а до мене в кімнату прилетіло сонечко.",8,прилетіло,прилетіти,при,летíти,сонечко,в,кімнату,Acc,кімната,В,metaphorical,
Від училищного правління в Комітет увійшли помічник наглядача училища Петро Фіделін та викладач Йосип Прокопович.,5,увійшли,увійти,в,іти́/йти́,помічник,в,Комітет,Acc,комітет,В,metaphorical,
"Чотири трикімнатні квартири з виходами на вузькі двомаршові сходи з боку подвір'я були ув'язані з виступним об'ємом чорних дерев'яних сходів, на які виходили кухні.",22,виходили,виходити,ви,ходи́ти,кухні,на,які,Acc,який,На,metaphorical,
"Організатори заходу – ініціатива «Відкритий парламент», до якої входить ЦЕДЕМ, а також Верховна Рада та Робоча група з законодавчої відкритості Партнерства «Відкритий уряд».",8,входить,входити,в,ходи́ти,ЦЕДЕМ,до,якої,Gen,який,До,metaphorical,
"Постараємось дати правдиву інформацію про те, як впливає на організм тривале утримання у жінок та його наслідки.",7,впливає,впливати,в,пла́вати,,на,організм,Acc,організм,На,metaphorical,another meaning
Через рік я приїхав додому у відпустку перед травневими святами.,3,приїхав,приїхати,при,ї́хати,я,у,відпустку,Acc,відпустка,В,literal,
"Все здібне до оружя українське население має утворити боєві відділи, які або ввійдуть в склад української армії або на місцях оберігатимуть спокій і порядок.",12,ввійдуть,ввійти,в,іти́/йти́,які,в,склад,Acc,склад,В,metaphorical,
"Але для цього потрібно прийти до себе і опам’ятатися, побачити своє безпорадне становище, увізвати до Бога про помилування.",4,прийти,прийти,при,іти́/йти́,,до,себе,Gen,себе,До,metaphorical,
"Розкриваючи світ духу, область віри, ікона благодатно впливає на стурбований дух людини, вказуючи єдиний шлях до спасіння – віру Православну, віру Церковну.",7,впливає,впливати,в,пла́вати,ікона,на,дух,Acc,дух,На,metaphorical,another meaning
"І нехай кожна прочитана сторінка, кожен спогад ветерана знов нагадає нам, якою дорогою ціною прийшло у наш край визволення.",14,прийшло,прийти,при,іти́/йти́,,у,край,Acc,край,В,metaphorical,
Проте переговори зайшли в глухий кут.,2,зайшли,зайти,за,іти́/йти́,переговори,в,кут,Acc,кут,В,metaphorical,
Матяш виліз на дерево і межи гіллям сховався.,1,виліз,вилізти,ви,лíзти,Матяш,на,дерево,Acc,дерево,На,literal,
"ZБК оприлюднило публікацію про монополізацію ринку постачання для ПАТ “Львівський локомотиворемонтний завод”, що входить в структуру власності АТ “Укрзалізниця”, сумнівними фірмами, які пов’язані з родиною бізнесмена Капирулі.",13,входить,входити,в,ходи́ти,,в,структуру,Acc,структура,В,metaphorical,
"Коли ми заходимо в будь-яке приміщення, то перше, на чому зупиняється наш погляд - це меблі і стіни.",2,заходимо,заходити,за,ходи́ти,ми,в,приміщення,Acc,приміщення,В,literal,
"Як прийшов буквар Добровольського до ради попечителя у Києві, там перелякались не самого букваря, а заголовка його «для южнорусских школ».",1,прийшов,прийти,при,іти́/йти́,буквар,до,ради,Gen,рада,До,metaphorical,
"Стаття присвячена дослідженню формування фінансового потенціалу підприємства, а також факторів, які впливають на його становлення.",11,впливають,впливати,в,пла́вати,які,на,становлення,Acc,становлення,На,metaphorical,another meaning
"Так як кондиціонер прямо впливає на клімат у Вашій квартирі, офісі, дачі, важливо підходити до вибору, купівлі, монтажу та сервісу більш зважено, уважно вивчивши ринок.",4,впливає,впливати,в,пла́вати,кондиціонер,на,клімат,Acc,клімат,На,metaphorical,another meaning
Зростання швидкостей механічної обробки сталей і сплавів у сучасному машинобудуванні впливає на вимоги до інструментальних матеріалів.,10,впливає,впливати,в,пла́вати,Зростання,на,вимоги,Acc,вимога,На,metaphorical,another meaning
"До її складу увійдуть голови ОСББ, керівники районів, профільні фахівці, депутати міськради та представники громадськості.",3,увійдуть,увійти,в,іти́/йти́,голови,до,складу,Gen,склад,До,metaphorical,
У комплект термобілизни входять кофта і штани.,3,входять,входити,в,ходи́ти,кофта,у,комплект,Acc,комплект,В,metaphorical,
"У 1846-1848 роках видав вісім томів своїх прозових творів, до яких увійшли понад 50 повістей, романів і оповідань.",11,увійшли,увійти,в,іти́/йти́,,до,яких,Gen,який,До,metaphorical,
"«Дійсно завдяки тому, що введено в експлуатацію три котельні, що працюють використовуючи деревину, в Тлумачі вдасться зекономити близько двох з половиною мільйонів гривень бюджетних коштів.",4,введено,ввести,в,вести́,,в,експлуатацію,Acc,експлуатація,В,metaphorical,
"Сходіть на дикий пляж вночі, покатайтесь на американських гірках, приготуйте вечерю разом, сходіть в кінотеатр на новий фільм тощо. Просто робіть те, що приносить задоволення вам обом.",0,Сходіть,сходити,з,ходи́ти,,на,пляж,Acc,пляж,На,literal,
"До них варто віднести людей, які активно займаються фізичними навантаженнями або піднімають тяжкості.",3,віднести,віднести,від,нести́,,до,них,Gen,вони,До,metaphorical,
"Що стосується інтернет-залежності, постраждалі діти не можуть впливати на їх діяльність в інтернеті.",7,впливати,впливати,в,пла́вати,,на,діяльність,Acc,діяльність,На,metaphorical,another meaning
"Це був момент неймовірного піднесення, коли наші душі справді злетіли високо-високо в безхмарне чисте небо і здавалося, що у нас виросли крила.",9,злетіли,злетіти,з,летíти,душі,в,небо,Acc,небо,В,metaphorical,
При надходженні достатніх коштів для друку хоча б мінімального накладу через кілька днів може вийти у світ.,14,вийти,вийти,ви,іти́/йти́,,у,світ,Acc,світ,В,metaphorical,
"Уданому випадку український еквівалент входить до тієї ж тематичної групи, що й польський płakać (cieszyć się) jak dziecko – український еквівалент теж належить до тематичної групи ""людина плакати (радіти, тішитися) як дитина.",4,входить,входити,в,ходи́ти,еквівалент,до,групи,Gen,група,До,metaphorical,
"І ось принесли до храму цю свічку, запалили, освятили, і винесли.",2,принесли,принести,при,нести́,,до,храму,Gen,храм,До,literal,
Рекорд зафіксували та занесли до Національного реєстру рекордів України.,3,занесли,занести,за,нести́,,до,реєстру,Gen,реєстр,До,metaphorical,
"Так що треба завтра прийти на площу Ринок, щоб не забували про наше місто!",4,прийти,прийти,при,іти́/йти́,,на,площу,Acc,площа,На,literal,
"Більшим ступінь диференціації продукції спричиняє потреба використання комплексу маркетингу, до складу якого входить «рпсе»",12,входить,входити,в,ходи́ти,рпсе,до,складу,Gen,склад,До,metaphorical,
"І той, хто відважиться його безумовно принести на вівтар Богові, прийме його знову, але у стократ більше, перемінене та ославлене.",6,принести,принести,при,нести́,,на,вівтар,Acc,вівтар,На,metaphorical,
До його могили приходять тисячi людей.,3,приходять,приходити,при,ходи́ти,людей,до,могили,Gen,могила,До,literal,
Він впливає на швидкість росту рослин.,1,впливає,впливати,в,пла́вати,Він,на,швидкість,Acc,швидкість,На,metaphorical,another meaning
"Часто розташування Шацьких озер, відносять до Українських Карпат.",4,відносять,відносити,від,носи́ти,,до,Карпат,Gen,карпати,До,metaphorical,
До кінця 60-х і початку 70-х років міжнародний автомобільний транспорт вже злетів у великий шлях.,11,злетів,злетіти,з,летíти,транспорт,у,шлях,Acc,шлях,В,metaphorical,
"За цей період у області введено в дію 1012,93 км газопроводів, газифіковано природним газом 125760 квартир, збудовано 40 ГРП та 86 ШРП.",5,введено,ввести,в,вести́,,в,дію,Acc,дія,В,metaphorical,
"Що ж до конкретної географії подібних оздоровчих візитів, то зараз до нас приїздять лікуватися переважно пацієнти з держав східноєвропейського регіону та Африки.",12,приїздять,приїздити,при,ї́здити,пацієнти,до,нас,Gen,ми,До,literal,
"У цій церкві в 1838 р. вперше в Качанівці співав хор під управлінням М. І. Глінки за участю знаменитого співака С. С. Гулака-Артемовського (1813-1873), що приїздив в Україну підбирати хлопчиків для хорової капели при царському дворі.",25,приїздив,приїздити,при,ї́здити,,в,Україну,Acc,україна,В,literal,
"Коли українські війська стали підходити до молдавських кордонів, їм назустріч виступив на чолі 60-тисячної армії великий коронний гетьман Калиновський.",4,підходити,підходити,під,ходи́ти,,до,кордонів,Gen,кордон,До,literal,
На користь українцям прийшло вміння Дениса Попова грати на другому поверсі біля чужих воріт.,3,прийшло,прийти,при,іти́/йти́,вміння,на,користь,Acc,користь,На,metaphorical,
Першим увів термін «соціологія» у науковий обіг.,1,увів,увести,в,вести́,,у,обіг,Acc,обіг,В,metaphorical,
"Вона взяла різко вправо, перетнула дорогу і стала заходити противнику у фланг і тил, що вирішило результат бою і тут.",8,заходити,заходити,за,ходи́ти,,у,фланг,Acc,фланг,В,literal,
"Виразне читання поезії А. А. Фета «Я прийшов до тебе, мила…»",7,прийшов,прийти,при,іти́/йти́,Я,до,тебе,Gen,ти,До,literal,
"Священна подія Преображення Господнього нагадує нам усім про те, що для того, щоб увійти в ту славу, яку Господь показав на Фаворській горі і обіцяє своїм вірним дітям, ми повинні преобразити свою душу.",13,увійти,увійти,в,іти́/йти́,,в,славу,Acc,слава,В,metaphorical,
"Рідина бурштинового або світло-коричневого кольору, має специфічний запах, зумовлений букетом ароматів входять до складу рослин.",11,входять,входити,в,ходи́ти,,до,складу,Gen,склад,До,metaphorical,
"Ледь живого Адріана знову віднесли у в’язницю, а свята Наталія йшла слідом за ним.",4,віднесли,віднести,від,нести́,,у,в’язницю,Acc,в’язниця,В,literal,
"В будь-якому разі перед Пасхою школярів попереджали, щоб вони у жодному випадку не приходили до церкви, порушників повинні були записувати та потім “розбиратися” із ними.",13,приходили,приходити,при,ходи́ти,вони,до,церкви,Gen,церква,До,literal,
"Річ ДеВос також був власником кількох професійних спортивних команд, у тому числі баскетбольної команди Orlando Magic, що входить до складу Національної баскетбольної асоціації.",17,входить,входити,в,ходи́ти,,до,складу,Gen,склад,До,metaphorical,
"Однак В. О. Лучін відзначає, що на формування цих правовідносин впливають не тільки конституційні норми.",10,впливають,впливати,в,пла́вати,норми,на,формування,Acc,формування,На,metaphorical,another meaning
З цим простим питанням я прийшла сьогодні до лікарні.,5,прийшла,прийти,при,іти́/йти́,я,до,лікарні,Gen,лікарня,До,literal,
"Наші спортсмени 19 разів сходили на п'єдестал, виборовши 4 срібні й 15 бронзових медалей.",4,сходили,сходити,з,ходи́ти,спортсмени,на,п'єдестал,Acc,п’єдестал,На,metaphorical,
Несвоєчасне і неадекватне лікування тиннітуса може привести до погіршення або втрати слуху.,6,привести,привести,при,вести́,,до,погіршення,Gen,погіршення,До,metaphorical,
"Попри «недріманний» нагляд КДБ, з «Гончарівні» в сучасну Україну вийшло чимало науковців, митців, народознавців, спрямованих І.М.Гончаром з псевдоакадемізованої радянської школи на народно-поетичне усвідомлення національного мистецтва.",9,вийшло,вийти,ви,іти́/йти́,науковців,в,Україну,Acc,україна,В,metaphorical,
"Дійшло до того, що Мануель Нойєр банально виносив м'яч на чужу половину поля.",7,виносив,виносити,ви,носи́ти,Мануель,на,половину,Acc,половина,На,literal,
Пам’ять справжнього захисника України вони вшанували хвилиною мовчання та піднесли квіти до могили.,9,піднесли,піднести,під,нести́,,до,могили,Gen,могила,До,literal,
"При замовлені бані на території готелю Кілкія, в її вартість входить чай з карпатських трав. Також, додатково Ви можете замовити рушники, віники, та інший додатковий інвентар для комфортного відпочинку в бані Кілікія.",10,входить,входити,в,ходи́ти,чай,в,вартість,Acc,вартість,В,metaphorical,
На зміну «старому» «Водоканалу» прийшов «новий» «Водоканал Плюс».,4,прийшов,прийти,при,іти́/йти́,Водоканал,на,зміну,Acc,зміна,На,metaphorical,
"Коли закічилися Літургія, син сам встав з візочка, підійшов до мами і сказав: ""Мамо, ходімо додому"".",8,підійшов,підійти,під,іти́/йти́,,до,мами,Gen,мама,До,literal,
"Більшість спеціалістів-медиків дотримується тієї думки, що помірна кількість кофеїну (чотири чашки кави на день) позитивно впливає на самопочуття і не може спричинити ані найменшої шкоди.",15,впливає,впливати,в,пла́вати,кількість,на,самопочуття,Acc,самопочуття,На,metaphorical,another meaning
"За допомогою ОК, адвокат може легко донести до потенційного клієнта вичерпні дані про себе та розширити коло своїх контактів.",6,донести,донести,до,нести́,,до,клієнта,Gen,клієнт,До,metaphorical,
Привести мережу вищих навчальних закладів у відповідність до внесе-змін та доповнень до зазначених вище законів.,0,Привести,привести,при,вести́,,у,відповідність,Acc,відповідність,В,metaphorical,
З 28.06.2011 споруду внесено до списку об’єктів світової спадщини ЮНЕСКО.,3,внесено,внести,в,нести́,,до,списку,Gen,список,До,metaphorical,
"Доля подарувала Шарлю Бодлеру лише 46 років, але він назавжди увійшов до еліти світової класики.",10,увійшов,увійти,в,іти́/йти́,він,до,еліти,Gen,еліта,До,metaphorical,
"Христос прийшов на землю Ізраїлю, де його люд терпів від римського панування і зради власних еліт.",1,прийшов,прийти,при,іти́/йти́,Христос,на,землю,Acc,земля,На,literal,
"Ми обов`язково будемо приходити до Вас в гості і надавати підтримку», - зазначила Олена Горпинченко.",3,приходити,приходити,при,ходи́ти,Ми,в,гості,Acc,гість,В,literal,
"Біля новобудов власники новеньких квартир, а це було переважно сільське населення, яке приїхало до міста працювати на нововідкритих фабриках і заводах, вважали святим обов’язком посадити дерево.",12,приїхало,приїхати,при,ї́хати,яке,до,міста,Gen,місто,До,literal,
"Раз я вже вийшов на поле літератури, я не можу доповнювати ряд блазнів, які навколо щебечуть, славлять партію, уникають щирості і пристосовуються до офіційного фальшу, і дарують один одному книжечки.",3,вийшов,вийти,ви,іти́/йти́,я,на,поле,Acc,поле,На,metaphorical,
"І так, як тільки ви зареєструвалися, до вас на пошту прийде лист з підтвердженням реєстрації, після чого ви зможете зайти на сайт.",10,прийде,прийти,при,іти́/йти́,лист,на,пошту,Acc,пошта,На,metaphorical,
"Конкурентні пропозиції Midea і прагнення виводити на ринок нові серії обладнання, призводить до періодичної зміни модельного ряду тієї чи іншої продукції.",5,виводити,виводити,ви,води́ти,,на,ринок,Acc,ринок,На,metaphorical,
"Якщо в когось бракує сил душевних, фізичних, людина ходить, аж заточується, Ніна Петрівна, радить взяти з собою когось із друзів чи близьких, відійти подалі в ліс і розпалити багаття.",22,відійти,відійти,від,іти́/йти́,,в,ліс,Acc,ліс,В,literal,
"Цілком слушно, наприклад, фонди чоловічої та жіночої гімназії, що діяли в повітовому місті Сороки на початку ХХ сторіччя (за «старою» обліковою документацією: Ф. 555 та Ф. 161), увійшли до одного й того ж фонду у вигляді описів (відповідно: Ф. 1862.",27,увійшли,увійти,в,іти́/йти́,фонди,до,одного,Gen,один,До,metaphorical,
