Sentence,Verb_index,Verb,Verb_lemma,Prefix,Stem,Subject,Preposition,Object,Object_case,Object_lemma,Unified_preposition,Motion_type,
Вдосконалення технологічної структури в цьому напрямі істотно впливає на скорочення строку окупності капіталовкладень і фондовіддачу основних виробничих фондів.,7,впливає,впливати,в,пла́вати,Вдосконалення,на,скорочення,Acc,скорочення,На,metaphorical,another meaning
Сергій почув пісні під гітару й вийшов на другий поверх «Малевича».,6,вийшов,вийти,ви,іти́/йти́,,на,поверх,Acc,поверх,На,literal,
"Також даний гормон стимулює синтез тестостерону і, відповідно, впливає на формування статевих органів у хлопчиків ще в період внутрішньоутробного розвитку.",8,впливає,впливати,в,пла́вати,,в,період,Acc,період,В,metaphorical,another meaning
Адже ви можете не тільки в День Матері принести в дім свято.,8,принести,принести,при,нести́,,в,дім,Acc,дім,В,metaphorical,
"У 1672 році до її складу увійшла Рождественська сотня, яка існувала з 1654 року.",6,увійшла,увійти,в,іти́/йти́,сотня,до,складу,Gen,склад,До,metaphorical,
"Тож я думаю, що Путін буде скеровувати свою політику, аби підвести Україну до краю прірви, примусити зробити цей крок через дестабілізацію, блокування реформ й підживлення корупції.",10,підвести,підвести,під,вести́,,до,краю,Gen,край,До,metaphorical,
Ось і підійшов до завершення навчальний 2018-2019 рік Університету третього віку.,2,підійшов,підійти,під,іти́/йти́,,до,завершення,Gen,завершення,До,metaphorical,
"Обійшовши лісом лагер і село Ударне, вийшов на колію і, пробігши по ній, повернув у ліс. Небо стало очищатися від хмар, і, орієнтуючись по сонцю, я побіг на Захід.",6,вийшов,вийти,ви,іти́/йти́,,на,колію,Acc,колія,На,literal,
"Банки, що входять до бізнес-груп, стрімко нарощують активи.",2,входять,входити,в,ходи́ти,,до,бізнес,Gen,бізнес,До,metaphorical,
"До складу Індії входять Лаккадівські, Аміндівські, Андаманські й Нікобарські острови.",3,входять,входити,в,ходи́ти,острови,до,складу,Gen,склад,До,metaphorical,
"Якщо вони не вміють плавати, не дозволяйте їм, заходити у воду глибше ніж по пояс, плавати на надувних матрацах або камерах.",8,заходити,заходити,за,ходи́ти,,у,воду,Acc,вода,В,literal,
"У “1С:Підприємство 8 УНФ” немає функціоналу для автоматичного розрахунку податків, тому нараховані податки потрібно заносити в програму вручну.",14,заносити,заносити,за,носи́ти,,в,програму,Acc,програма,В,metaphorical,
"Так як орієнтація не впливає негативно ні на психіку, ні на фізіологічне здоров'я, ні навіть, на моральну конкретність моделі поведінки, будучи лише орієнтацією і ні чим більше.",4,впливає,впливати,в,пла́вати,орієнтація,на,психіку,Acc,психіка,На,metaphorical,another meaning
"Компанія ТОВ «Хюндай Моторс Україна» - офіційний дистриб'ютор автомобілів ТМ HYUNDAI в Україні, яка входить до складу корпорації «Богдан».",14,входить,входити,в,ходи́ти,яка,до,складу,Gen,склад,До,metaphorical,
"Нуся швиденько сіла на гойдалку, притулила до грудей чаривізор, Цибулька вмостився у неї на руках, сова й пугач змахнули крилами, і вони злетіли в небо.",22,злетіли,злетіти,з,летíти,вони,в,небо,Acc,небо,В,literal,
"Він може також увійти до контакту і передати Душі те, що відоме людині у фізичному втіленні.",3,увійти,увійти,в,іти́/йти́,,до,контакту,Gen,контакт,До,metaphorical,
"Дана обставина свідчить про те, що будь-які обставини, що входять в предмет доведення, мають свою межу доведення.",9,входять,входити,в,ходи́ти,,в,предмет,Acc,предмет,В,metaphorical,
Приходити на процедуру прийнято лише через кілька годин після прийому їжі.,0,Приходити,приходити,при,ходи́ти,,на,процедуру,Acc,процедура,На,literal,
Цю машину можна віднести до розряду раритетів.,3,віднести,віднести,від,нести́,,до,розряду,Gen,розряда,До,metaphorical,
"Опори ємності та її конус істотно впливають на вартість виробу, саме тому наше підприємство розробило лінійку ємностей з повним 100% зливом без використання конуса.",6,впливають,впливати,в,пла́вати,Опори,на,вартість,Acc,вартість,На,metaphorical,another meaning
"За попередніми даними 23-річний водій автомобіля «» при виконанні обгону виїхав на смугу зустрічного руху, де скоїв зіткнення з автомобілем «",10,виїхав,виїхати,ви,ї́хати,водій,на,смугу,Acc,смуга,На,literal,
"Це може стати причиною витоку тепла з приміщення, що негативно впливає на стан зруба та загальну атмосферу в помешканні.",10,впливає,впливати,в,пла́вати,,на,стан,Acc,стан,На,metaphorical,another meaning
"Право користування земельною ділянкою державної або комунальної власності не може бути відчужено її землекористувачем іншим особам, внесено до статутного капіталу, передано у заставу.",16,внесено,внести,в,нести́,,до,капіталу,Gen,капітал,До,metaphorical,
"У гірських районах на заплавах і перших річкових терасах росте низка видів рослин, які занесено до українських і міжнародних охоронних списків.",14,занесено,занести,за,нести́,,до,списків,Gen,список,До,metaphorical,
До комплекту входять декоративні подушки.,2,входять,входити,в,ходи́ти,подушки,до,комплекту,Gen,комплект,До,metaphorical,
"По-перше, перебування під відкритим сонцем необхідно звести до мінімуму, але не виключати зовсім.",6,звести,звести,з,вести́,,до,мінімуму,Gen,мінімум,До,metaphorical,
Верховна Рада України постановляє: Віднести місто Ватутіне Звенигородського району Черкаської області до категорії міст обласного підпорядкування.,4,Віднести,віднести,від,нести́,,до,категорії,Gen,категорія,До,metaphorical,
"До неї ввійдуть всі народи, тому протягом століть треба, щоб вона мала своїх священиків і пастирів, якими були після Вознесіння Ісуса Христа апостоли.",2,ввійдуть,ввійти,в,іти́/йти́,народи,до,неї,Gen,вона,До,metaphorical,
"Коли святого апостола Іоанна Богослова привезли на місце його заслання – острів Патмос – і передали ігемону, тобто начальнику, правителю острова.",5,привезли,привезти,при,везти́,,на,місце,Acc,місце,На,literal,
"Це незнання хіба що опосередковано може вплинути на політику, тому неіснування України в американській свідомості дещо впливає на дискурс, на поп-культуру, на представленість України та українців у цій же поп-культурі.",16,впливає,впливати,в,пла́вати,неіснування,на,дискурс,Acc,дискурс,На,metaphorical,another meaning
Несвоєчасна терапія трипера може привести до плачевних наслідків у вигляді серйозних ускладнень.,4,привести,привести,при,вести́,,до,наслідків,Gen,наслідок,До,metaphorical,
Після нанесення складу небажано виходити на вулицю.,4,виходити,виходити,ви,ходи́ти,,на,вулицю,Acc,вулиця,На,literal,
"Громадянська мережа ОПОРА поцікавилась, чим саме зараз займається цей відділ, як впливає на скорочення енергоресурсів та до чого прагне у майбутньому.",11,впливає,впливати,в,пла́вати,,на,скорочення,Acc,скорочення,На,metaphorical,another meaning
"Але поїхав його послушник у Ленінград вчитися і закохався там у дівчину, що із цікавості прийшла недільного дня з бабусею в Нікольський собор на службу Божу.",15,прийшла,прийти,при,іти́/йти́,,на,службу,Acc,служба,На,literal,
"Сполучене Королівство Великої Британії, а також Північної Ірландії не входить в бажану багатьом Шенгенську зону.",9,входить,входити,в,ходи́ти,Королівство,в,зону,Acc,зона,В,metaphorical,
"Українська держава закрила останній полігон, куди ми могли вивозити сміття зі Львова.	8	вивозити	вивозити	ви	вози́ти	None	зі	Львова	Gen	Львів
Українська держава йде шляхом демократичного розвитку.	2	йде	йти	None	None	держава	шляхом	розвитку	Gen	розвиток
Українська діаспора в Росії вболіває за Майдан серцем: виходити на пікети - небезпечно Уся українська діаспора з хвилюванням спостерігає за Майданом.	8	виходити	виходити	ви	ходи́ти	None	на	пікети	Acc	пікет
Українська жіноча байдарка в останні роки стабільно приносить медалі на змаганнях міжнародного рівня.	7	приносить	приносити	при	носи́ти	байдарка	на	змаганнях	Loc	змагання
Українська збірна увійшла до трійки найсильніших за загальною кількістю нагород і за кількістю золотих медалей.	2	увійшла	увійти	в	іти́/йти́	збірна	до	трійки	Gen	трійка
Українська земля щедро полита кров`ю українців, які боролися за свою свободу та кровю інших народів, що прийшли на нашу землю в інтересах своїх імперій.	16	прийшли	прийти	при	іти́/йти́	None	в	інтересах	Loc	інтерес
Українська кліматична мережа, до якої входить Екодія, оприлюднила заяву від імені 30 екологічних ініціатив з вимогою до Уряду про перегляд національних цілей кліматичної політики та зобов’язань України, щоб достойно представити позицію України на COP24.	5	входить	входити	в	ходи́ти	Екодія	до	якої	Gen	який
Українська літератураВи не пройшли ідентифікацію (	3	пройшли	пройти	None	None	літератураВи	None	None	None	None
Українська модель Ганна Костенко, яка перемогла в конкурсі “Міс Євразія-2019” пообіцяла вийти заміж за того, хто поверне їй корону.	11	вийти	вийти	ви	іти́/йти́	None	за	того	Acc	той
Українська народна традиція донесла крізь століття численні види рукоділля, займатися якими можуть тільки посидючі, працьовиті та талановиті люди.	3	донесла	донести	до	нести́	традиція	крізь	століття	Acc	століття
Українська наука має не лише славне минуле, але й велике майбутнєПід час свого професійного свята іменинники одержували привітання і нагороди, фестивалили, конкурували і виходили на «медичні пікніки»…	23	виходили	виходити	ви	ходи́ти	None	на	пікніки	Acc	пікніка
Українська не входила до цього переліку.	2	входила	входити	в	ходи́ти	Українська	до	переліку	Gen	перелік
Українська правда"" пояснює, навіщо Росія затримує судна, чи має вона на це право, і як блокування Азовського моря впливає на Україну.",18,впливає,впливати,в,пла́вати,блокування,на,Україну,Acc,україна,На,metaphorical,another meaning
"До списку увійшли відомі підприємства, а керівники та власники багатьох з них є знаними людьми.",2,увійшли,увійти,в,іти́/йти́,підприємства,до,списку,Gen,список,До,metaphorical,
"Якщо зайти в це приміщення, яке часто виручає закоханих, — ліворуч буде кавова точка, але йдіть прямо, чемно вітайтеся і промовляйте: «Я хочу назвати вам пароль від «Цікавої газети на вихідні».",1,зайти,зайти,за,іти́/йти́,,в,приміщення,Acc,приміщення,В,literal,
"Нагадуємо, щоб проголосувати за проекти потрібно зайти на сайт https://gb.",6,зайти,зайти,за,іти́/йти́,,на,сайт,Acc,сайт,На,metaphorical,
"Футбольній асоціації студентів міста Києва хотілося б побажати росту - виходити на нові рівні розвитку, щоб дійсно студентський футбол став основоположною ланкою у формуванні здоров'я молоді та щаблем до команди майстрів.",10,виходити,виходити,ви,ходи́ти,,на,рівні,Acc,рівень,На,metaphorical,
"До пріоритетів реформи правосуддя входять якісне оновлення суддівського корпусу та забезпечення його незалежності, залучення громадян до судочинства, а також забезпечення належної якості кадрів у системі слідства, прокуратури, адвокатури і суду.",4,входять,входити,в,ходи́ти,оновлення,до,пріоритетів,Gen,пріоритет,До,metaphorical,
"Підрісши, Сергій вступив до гімназії у місті Златополі (нині входить до складу міста Новомиргорода Кіровоградської області), з якою пов’язані роки навчання чи викладацька праця В. Винниченка, М. Зерова, Б. Лятошинського, П.Филиповича та інших.",9,входить,входити,в,ходи́ти,,до,складу,Gen,склад,До,metaphorical,
"Гальмуючи дію одних ферментів, підсилюючи у малих концентраціях дію інших, фтор може впливати на швидкість і напрямок біохімічних процесів.",12,впливати,впливати,в,пла́вати,,на,швидкість,Acc,швидкість,На,metaphorical,another meaning
"Проте винятки з принципів визнання чи оцінки стосовно певних статей, розглянутих у параграфах 22 - 31, також можуть привести до визнання прибутку (або зміни в сумі визнаного прибутку) від вигідної покупки.",18,привести,привести,при,вести́,,до,визнання,Gen,визнання,До,metaphorical,
Часті зміни у законодавстві України також впливають на стан управління капіталом підприємств.,6,впливають,впливати,в,пла́вати,зміни,на,стан,Acc,стан,На,metaphorical,another meaning
Через деякий час на подвір’я зайшов старий і стомлений чоловік.,5,зайшов,зайти,за,іти́/йти́,чоловік,на,подвір’я,Acc,подвір’я,На,literal,
"Параметри називаються внутрішніми, якщо вони визначаються сукупним рухом і розподілом в просторі тіл і частинок, що входять в систему.",16,входять,входити,в,ходи́ти,,в,систему,Acc,система,В,metaphorical,
"Підліток не завжди уміє виділити, узагальнити особисті якості, ввести їх у коло тих чи інших понять, зробити правильний висновок про те, чи є вони випадковими чи, дійсно, відносяться до характеристики особистості.",8,ввести,ввести,в,вести́,,у,коло,Acc,коло,В,metaphorical,
"Він влетів у той ряд, де вони сиділи, ошелешений, проте неушкоджений.",1,влетів,влетіти,в,летíти,Він,у,ряд,Acc,ряд,В,literal,
"Однак наявність лише внутрішньої волі для здійснення операції недостатньо, необхідно її довести до відома інших осіб. Способи, якими внутрішня воля виражається зовні, називаються волевиявленням.",11,довести,довести,до,вести́,,до,відома,Gen,відомий,До,metaphorical,
"Таким чином виявляються характеристики, що ведуть до вищої якості роботи та визнання, у тому числі до позитивних оцінок, які впливають на рішення про підвищення за наявності вакансій.",19,впливають,впливати,в,пла́вати,які,на,рішення,Acc,рішення,На,metaphorical,another meaning
Дрібниця може ощасливити таких хворих або довести до відчаю.,6,довести,довести,до,вести́,,до,відчаю,Gen,відчай,До,metaphorical,
Андрій заходить до будинку.,1,заходить,заходити,за,ходи́ти,Андрій,до,будинку,Gen,будинок,До,literal,
Студенти різних курсів коледжу входять до цього творчого колективу.,4,входять,входити,в,ходи́ти,Студенти,до,колективу,Gen,колектив,До,metaphorical,
"Звичайно ж, якщо ці знання є) До такого висновку прийшли і навіть довели за допомогою результатів фМРТ в Чиказькому університеті, - передає Medical Xpress.",9,прийшли,прийти,при,іти́/йти́,,до,висновку,Gen,висновок,До,metaphorical,
"Аналіз зазначених порушень показує, що уникнення застосування визначених законом процедур закупівель приводить до непрозорого та нераціонального використання бюджетних кошків.",11,приводить,приводити,при,води́ти,уникнення,до,використання,Gen,використання,До,metaphorical,
На самостійну роботу студентів відведено 63 години.,4,відведено,відвести,від,вести́,,на,роботу,Acc,робота,На,metaphorical,
"УЄФА займається організацією європейських змагань клубів і збірних, розподіляє прибутки від реклами й трансляції турнірів, що проходять під її егідою, між клубами й національними асоціаціями, що входять до її складу.",26,входять,входити,в,ходи́ти,,до,складу,Gen,склад,До,metaphorical,
"Є, каже, в мене один товариш у Німеччині, який приїздить раз на рік до мене … за грибами.",9,приїздить,приїздити,при,ї́здити,який,до,мене,Gen,я,До,literal,
"І хоч супроводження вечірок не входить в цільові задачі пристрою, проте організувати домашню вечірку однозначно вийде, так як потужності акустичної системи значно більше ніж навіть для цього потрібно.",5,входить,входити,в,ходи́ти,супроводження,в,задачі,Acc,задача,В,metaphorical,
"Проводиться лікування захворювань, які привели до втрати рідини, а також проводиться корекція електролітів крові.",4,привели,привести,при,вести́,які,до,втрати,Gen,втрата,До,metaphorical,
