Sentence,Verb_index,Verb,Verb_lemma,Prefix,Stem,Subject,Preposition,Object,Object_case,Object_lemma,Unified_preposition,Motion_type,
"І я переконаний, що Божа сила, яка, за словами апостола Павла, проявляється у наших немощах, є тією силою Воскреслого, який підносить нас до нового життя.",20,підносить,підносити,під,носи́ти,який,до,життя,Gen,життя,До,metaphorical,
"Пропонуєте заїхати в центр, сісти на трамвай №6 а потім пересісти на 2А допустимо до мотозаводу?",1,заїхати,заїхати,за,ї́хати,,в,центр,Acc,центр,В,literal,
"Учені прийшли до висновку, що формування усного мовлення починається тоді, коли рух пальців досягає достатньої точності.",1,прийшли,прийти,при,іти́/йти́,Учені,до,висновку,Gen,висновок,До,metaphorical,
"Нехай Свято принесе у Ваші домівки радість та благополуччя, щастя та міцне здоров’я, наповнить серця ваші добром та милосердям.",2,принесе,принести,при,нести́,,у,домівки,Acc,домівка,В,literal,
"Центральна влада не має права тиском впливати на місцеву владу», – пояснив Вадим Олійник.",6,впливати,впливати,в,пла́вати,,на,владу,Acc,влада,На,metaphorical,another meaning
"За його запрошенням, Маккартні, прийшов на концерт групи.",4,прийшов,прийти,при,іти́/йти́,,на,концерт,Acc,концерт,На,literal,
"В п’ятницю, 11 листопада 2011 року, в Київ на відкриття Української Медіа Школи (УМШ) приїде провідний міжнародний тренер в медіаіндустрії Аннет Айріс, автор книги «Управління медіакомпанією.",14,приїде,приїхати,при,ї́хати,тренер,на,відкриття,Acc,відкриття,На,literal,
"Так, дійсно, у той час альтернативи цьому додатку не було, проте з появою таких потужних утиліт, як WinRAR і 7-Zip, основна програма відійшла на друге місце, оскільки архіви такого формату можна було створити і розпакувати за допомогою нових засобів.",22,відійшла,відійти,від,іти́/йти́,програма,на,місце,Acc,місце,На,metaphorical,
"І.П. Павлов своїми дослідженнями довів, що механічне подразнення слизової оболонки шлунка не приводить до виділення шлункового соку, у той час як при уявному годуванні він виділяється у великій кількості.",12,приводить,приводити,при,води́ти,подразнення,до,виділення,Gen,виділення,До,metaphorical,
"Втім, живучість таких поглядів мене не дивує: гадаю, сучасних дослідників увели в оману пізніші, з XVII ст. свідчення, що великою мірою використовували київське минуле.",10,увели,увести,в,вести́,свідчення,в,оману,Acc,омана,В,metaphorical,
Восени прийдуть до нас большевики.,1,прийдуть,прийти,при,іти́/йти́,большевики,до,нас,Gen,ми,До,literal,
"Масло рослини впливає на печінку людини, виводить з неї токсини, перешкоджає всмоктуванню з прийнятої їжі нових небезпечних речовин.",2,впливає,впливати,в,пла́вати,Масло,на,печінку,Acc,печінка,На,metaphorical,another meaning
"Оформлення операції з нерухомістю вимагає обережності, оскільки помилка при угоді може привести до значних фінансових втрат для клієнта.",11,привести,привести,при,вести́,,до,втрат,Gen,втрата,До,metaphorical,another meaning
"Наступного дня 2 лютого молодих знову вводили у храм, де остаточно проголошувалося створення нової родини.",6,вводили,вводити,в,води́ти,,у,храм,Acc,храм,В,literal,
"Вони мають здатність благодатно впливати на все, до чого торкаються: для врожаю їх закопують у землю, підкурюють хворих.",4,впливати,впливати,в,пла́вати,,на,все,Acc,все,На,metaphorical,another meaning
"Вистачить і склянки гарячої води, щоб настій вийшов густим і терпким на смак.",7,вийшов,вийти,ви,іти́/йти́,настій,на,смак,Acc,смак,На,metaphorical,
"До складу паперу входять світлостійкі пігменти, які забезпечують йому високі довговічність та стійкість до впливу сонячних променів.",3,входять,входити,в,ходи́ти,пігменти,до,складу,Gen,склад,До,metaphorical,
З метою зниження фіскального тиску на інновації як найбільш перспективні інвестиції держава дозволяла частину витрат на НДДКР віднести до валових витрат підприємства.,17,віднести,віднести,від,нести́,,до,витрат,Gen,витрата,До,metaphorical,
"Ще одна особливість села – воно центр сільської громади, в яку входить лише одне село.",11,входить,входити,в,ходи́ти,село,в,яку,Acc,який,В,metaphorical,
"Не старайтесь одразу купити речі, відкладіть їх та зайдіть в інших магазин.",8,зайдіть,зайти,за,іти́/йти́,,в,магазин,Acc,магазин,В,literal,
"Що стосується змін у сфері нерухомості, то власник земельної ділянки в разі його оренди може внести в реєстр вимогу (галочку), що всі договори, які укладаються ним, повинні бути нотаріально посвідчені.",15,внести,внести,в,нести́,,в,реєстр,Acc,реєстр,В,metaphorical,
"Мабуть, пасажири й команда потонули, бо на берег цього острова винесло одну корабельну дошку, за яку міцно трималася дівчина.",10,винесло,винести,ви,нести́,,на,берег,Acc,берег,На,literal,
На практиці визначення потреб у соціальних послугах зведено до визначення кількості отримувачів послуг (потенційних та фактичних).,7,зведено,звести,з,вести́,,до,визначення,Gen,визначення,До,metaphorical,
ВИРІШИЛИ: Винести на розгляд сесії районної ради проект рішення «Про затвердження Програми підтримки обдарованої учнівської молоді Сокальського району на 2019 рік.»,1,Винести,винести,ви,нести́,,на,розгляд,Acc,розгляд,На,metaphorical,
"До комплекту SB-700 входить система колірного фільтру, яку легко закріпити без клею, липучок і клейкої стрічки.",3,входить,входити,в,ходи́ти,система,до,комплекту,Gen,комплект,До,metaphorical,
"Мікроклімат кухні впливає і на інші поверхні, а неякісні або невідповідний матеріал шпалери буде тільки погіршувати ситуацію.",2,впливає,впливати,в,пла́вати,Мікроклімат,на,поверхні,Acc,поверхня,На,metaphorical,another meaning
"Препарат швидко всмоктується при застосуванні внутрішньо, прийом їжі не впливає на ступінь усмоктування, але знижує його швидкість.",9,впливає,впливати,в,пла́вати,прийом,на,ступінь,Acc,ступінь,На,metaphorical,another meaning
"Цукровий компонент розтопити в мікрохвильовці, але не доводите до кипіння.",7,доводите,доводити,до,води́ти,,до,кипіння,Gen,кипіння,До,metaphorical,
Юні українські вчені увійшли до числа 15 фіналістів Google Science FairОлексій Козлов та Мілена Клименко стали фіналістами Google Science Fair у віковій категорії «13-14.,3,увійшли,увійти,в,іти́/йти́,,до,числа,Gen,число,До,metaphorical,
Всі ці чинники привели до величезного руйнування в матеріалістичному світі і до вельми реального розширення людської свідомості.,3,привели,привести,при,вести́,чинники,до,руйнування,Gen,руйнування,До,metaphorical,
"Ізраїльтяни, зокрема, журналісти, мають намір приїхати на Львівщину ще до відкриття авіарейсу Львів-Тель-Авів.",5,приїхати,приїхати,при,ї́хати,,до,відкриття,Gen,відкриття,До,literal,
Студенти Львівського Національного Університету імені Івана Франка вийшли на акцію протесту біля головного корпусу вишу.,7,вийшли,вийти,ви,іти́/йти́,Студенти,на,акцію,Acc,акція,На,literal,
"ТОВ «Агро Кім» вже у червні планує розпочати перевезення першої черги свинарника з Кукшина до Галиці з тим, щоб до зими вже завезти свиноматок.",22,завезти,завезти,за,везти́,,до,зими,Gen,зима,До,literal,
"Для ефективного програмування слід вміти користуватися ними, а найголовніше – вміти вибирати правильні засоби, ті, які найкраще підходять до поставленої задачі.",17,підходять,підходити,під,ходи́ти,які,до,задачі,Gen,задача,До,metaphorical,
"Аби ввести місцевих в оману, ми влаштовували «паради».",1,ввести,ввести,в,вести́,,в,оману,Acc,омана,В,metaphorical,
До таких висновків прийшла команда Центру громадського контролю «ДІЙ!»,3,прийшла,прийти,при,іти́/йти́,команда,до,висновків,Gen,висновок,До,metaphorical,
На старт нової першості Екстра-ліги зразка 2015-2016 років вийдуть одразу дев’ять українських клубів.,8,вийдуть,вийти,ви,іти́/йти́,клубів,на,старт,Acc,старт,На,literal,
"ЮБ «Єгоров, Пугінскій, Афанасьєв і партнери» Україна знову увійшло до сотні найкращих юридичних фірм у сфері міжнародного арбітражу провідного світового видання Global Arbitration Review (GAR 100).",8,увійшло,увійти,в,іти́/йти́,Україна,до,сотні,Gen,сотня,До,metaphorical,
Цього року св. Миколай з Парафії св. Йоана Павла ІІ радісно приходив до дітей і дорослих.,11,приходив,приходити,при,ходи́ти,св,до,дітей,Gen,дитина,До,literal,
Як нам вийти на шлях соціального прогресу?,2,вийти,вийти,ви,іти́/йти́,,на,шлях,Acc,шлях,На,metaphorical,
Які базові речі входять у ваш повсякденний образ?,3,входять,входити,в,ходи́ти,речі,у,образ,Acc,образ,В,metaphorical,
"А може перед нами — онкопацієнт, який звик підходити до будь-якої проблеми практично.",8,підходити,підходити,під,ходи́ти,,до,проблеми,Gen,проблема,До,metaphorical,
"Саме тому довідка про несудимість входить в пакет документів, що надаються в більшості випадків.",5,входить,входити,в,ходи́ти,довідка,в,пакет,Acc,пакет,В,metaphorical,
Рівень ЛПВЩ сильно впливає на стан здоров’я всього організму.,3,впливає,впливати,в,пла́вати,Рівень,на,стан,Acc,стан,На,metaphorical,another meaning
"На поміч тут нам приходять малюки, які ще не вивчили «стандартних» матюків та користуються відомими для них словами, аби описати дійсність чи поведінку людини, щось на кшталт: «Ваші ноги смердять, як тухле яйце у смітнику Ґарґамеля».",4,приходять,приходити,при,ходи́ти,малюки,на,поміч,Acc,поміч,На,metaphorical,
"У музеї можна багато дізнатися і про героїв безсмертних творів Нечуя-Левицького, і про нього самого — від дитинства до останніх днів життя, які письменник провів у великій нужді і тихо відійшов у потойбічний світ.",30,відійшов,відійти,від,іти́/йти́,,у,світ,Acc,світ,В,metaphorical,
"«Але є також багато інших факторів, котрі істотно впливають на стан економіки.",8,впливають,впливати,в,пла́вати,котрі,на,стан,Acc,стан,На,metaphorical,another meaning
"Коли почув гуркіт (хворий піднявся і хотів вийти), разом з медсестрами і санітарками забігли у палату.",13,забігли,забігти,за,бíгти,,у,палату,Acc,палата,В,literal,
"На кількість цих справ впливає й те, наскільки страхова компанія і її клієнти довіряють цьому документу», — зазначає менеджер з комунікацій страхової компанії PZU в Україні Олександр Мельничук.",4,впливає,впливати,в,пла́вати,те,на,кількість,Acc,кількість,На,metaphorical,another meaning
"Тонізує серцевий м'яз, нормалізує обмінні процеси в організмі, позитивно впливає на стан нервової та кровотворної систем.",9,впливає,впливати,в,пла́вати,,на,стан,Acc,стан,На,metaphorical,another meaning
"На економію палива впливають різноманітні фактори: характеристика трансмісії та двигуна, манера водіння, стан дороги, своєчасне технічне обслуговування, опір коченню,.",3,впливають,впливати,в,пла́вати,фактори,на,економію,Acc,економія,На,metaphorical,another meaning
"Це такий напій, наповнений святковою смаком і без цукру, ідеально підходить для підготовки до Різдва.",10,підходить,підходити,під,ходи́ти,,до,Різдва,Gen,різдво,До,metaphorical,
"Єврей прийшов до тями, підвівся на ноги й не знав, як дякувати доброму незнайомцю.",1,прийшов,прийти,при,іти́/йти́,Єврей,до,тями,Gen,тяма,До,literal,
"Тільки ось думки про те, що життя надзвичайно крихке і швидкоплинне, приходять їй в голову набагато частіше, ніж це слід в її віці.",11,приходять,приходити,при,ходи́ти,,в,голову,Acc,голова,В,metaphorical,
"Не радить науковець їсти таблетовані вітаміни, бо зазвичай вони згубно впливають на печінку.",10,впливають,впливати,в,пла́вати,вони,на,печінку,Acc,печінка,На,metaphorical,another meaning
"«Це не є висока література, це просто від серця», - щиро каже Уляна Кацал, і залишається шкодувати, що в її збірку ввійшла лише незначна частина твореного цією львівською письменницею.",21,ввійшла,ввійти,в,іти́/йти́,частина,в,збірку,Acc,збірка,В,metaphorical,
"З усвідомленням того, що ця гібридна війна не скінчиться так швидко, як хотілося б, до багатьох людей приходить і бажання діяти, допомагати захисникам України, їх сім’ям та вимушеним переселенцям.",17,приходить,приходити,при,ходи́ти,бажання,до,людей,Gen,людина,До,metaphorical,
"“Тому йому важко визнати провину за 27 років удаваної діяльності, яка затягла всю повноту Православ’я в конфлікт.",11,затягла,затягти,за,тягти́,яка,в,конфлікт,Acc,конфлікт,В,metaphorical,
Перемігши усіх своїх суперників вони підійшли до останньої зустрічі з максимальним результатом - по 6 очок.,5,підійшли,підійти,під,іти́/йти́,вони,до,зустрічі,Gen,зустріч,До,metaphorical,
"Про це пізніше напише також прикарпатський письменник Михайло Шиптур у невеликій повісті-есеї «Наперекір долі», яка увійшла до його книжки «Важкий шлях до Олімпу».",15,увійшла,увійти,в,іти́/йти́,яка,до,книжки,Gen,книжка,До,metaphorical,
"Цей вітамін треба застосовувати й при дисбактеріозі кишечнику, тривалому лікуванні антибіотиками, придушують мікрофлору шлунково-кишкового тракту, приводить до порушень розумової діяльності, депресії, поліневритам (оніміння, поколювання в кінцівках).",15,приводить,приводити,при,води́ти,,до,порушень,Gen,порушення,До,metaphorical,
"На початку ХХІ століття кілька працівників музею вирішили здійснити подвижницький вчинок і занесли предмет до експозиційної зали «Єлисаветград промисловий», що було надскладним завданням, оскільки його вага – 150-200 кілограмів.",12,занесли,занести,за,нести́,,до,зали,Gen,зала,До,literal,
"· атракційно-економічну: центр є одним із екскурсійних об’єктів, входить в офіційні туристичні маршрути і приносить реальний прибуток.",8,входить,входити,в,ходи́ти,,в,маршрути,Acc,маршрут,В,metaphorical,
"Так, тодішня соціологія виводила Чорновола у лідери президентських змагань.",3,виводила,виводити,ви,води́ти,соціологія,у,лідери,Acc,лідер,В,metaphorical,
Отже підходимо до наступної характеристики еліти.,1,підходимо,підходити,під,ходи́ти,,до,характеристики,Gen,характеристика,До,metaphorical,
На місце проведення робіт з вирубки чагарнику безкоштовно виїде фахівець для оцінки обсягів робіт.,8,виїде,виїхати,ви,ї́хати,фахівець,на,місце,Acc,місце,На,literal,
"Для того, щоб продовжити свій кредит, Вам необхідно підійти в будь-яке відділення компанії і оформити додаткову угоду, сплативши суму процентів на день проведення пролонгації.",8,підійти,підійти,під,іти́/йти́,,в,відділення,Acc,відділення,В,literal,
"З урахуванням цього аналізу зроблено висновки щодо основних факторів, які впливають на її результативність протягом досліджуваного періоду, та запропоновано пріоритетні напрями розвитку галузі.",10,впливають,впливати,в,пла́вати,які,на,результативність,Acc,результативність,На,metaphorical,another meaning
"Головне - не вносити в цей документ жодних виправлень, інакше він буде визнаний недійсним.",3,вносити,вносити,в,носи́ти,,в,документ,Acc,документ,В,metaphorical,
"Щойно він буде готовий, плануємо внести в Парламент, як першочерговий для розгляду», ― зазначив Кутовий.",5,внести,внести,в,нести́,,в,Парламент,Acc,парламент,В,metaphorical,
"Він має в активі підготовлені складні стрибки і здатен зійти на п’єдестал, однак конкуренція в чоловічих акробатичних стрибках нині дуже висока.",9,зійти,зійти,з,іти́/йти́,,на,п’єдестал,Acc,п’єдестал,На,metaphorical,
"На дрезині якийсь телепень, нанюхавшись кокаїну, глибоко увійшов у роль птаха-кондора.",7,увійшов,увійти,в,іти́/йти́,телепень,у,роль,Acc,роль,В,metaphorical,
"Через те, що лікування від цього захворювання не розроблено, тваринникам треба дуже ретельно підійти до заходів профілактики і дотримання біобезпеки, аби унеможливити зараження тварин.",13,підійти,підійти,під,іти́/йти́,,до,заходів,Gen,захід,До,metaphorical,
